ID Банкомата;Адрес строкой RU;;;;;;;;;;;;;;;;;;;
ATM60405;Город Санкт-Петербург Улица Байконурская Дом 14;;;;;;;;;;;;;;;;;;;
ATM60407;Область Нижегородская Город Нижний Новгород Проспект Кораблестроителей Дом 22 Б;;;;;;;;;;;;;;;;;;;
ATM60408;Область Нижегородская Город Нижний Новгород Улица Баррикад Дом 1;;;;;;;;;;;;;;;;;;;
ATM60409;Область Иркутская Город Иркутск Улица Седова Дом 38/1;;;;;;;;;;;;;;;;;;;
ATM60410;Город Санкт-Петербург Набережная Грибоедова Канала Дом 13;;;;;;;;;;;;;;;;;;;
ATM60412;Область Нижегородская Город Нижний Новгород Поселок Аэропорт;;;;;;;;;;;;;;;;;;;
ATM60413;Область Самарская Город Самара Проспект Ленина Дом 14;;;;;;;;;;;;;;;;;;;
ATM60414;Область Нижегородская Город Нижний Новгород Улица Минина Дом 19;;;;;;;;;;;;;;;;;;;
ATM60415;Область Нижегородская Город Нижний Новгород Улица Веденяпина Дом 1-Б;;;;;;;;;;;;;;;;;;;
ATM60418;Область Нижегородская Город Нижний Новгород Шоссе Московское Дом 30;;;;;;;;;;;;;;;;;;;
ATM60425;Область Новосибирская Город Новосибирск Улица Орджоникидзе Дом 23;;;;;;;;;;;;;;;;;;;
ATM60428;Область Нижегородская Город Кстово Улица 40 лет Октября Дом 4;;;;;;;;;;;;;;;;;;;
ATM60435;Область Нижегородская Город Нижний Новгород Улица Родионова Дом 187;;;;;;;;;;;;;;;;;;;
ATM60436;Край Камчатский Район Елизовский Село Паратунка Улица Санаторная Дом 1;;;;;;;;;;;;;;;;;;;
ATM60437;Область Самарская Город Самара Улица Дыбенко Дом 30;;;;;;;;;;;;;;;;;;;
ATM60438;Область Самарская Город Самара Улица Дыбенко Дом 30;;;;;;;;;;;;;;;;;;;
ATM60448;Республика Бурятия Город Улан-Удэ Улица Бабушкина Дом 158;;;;;;;;;;;;;;;;;;;
ATM60449;Область Самарская Город Самара Улица Кирова Дом 147;;;;;;;;;;;;;;;;;;;
ATM60451;Город Санкт-Петербург Шоссе Пулковское Дом 25 стр.1;;;;;;;;;;;;;;;;;;;
ATM60452;Город Санкт-Петербург Шоссе Пулковское Дом 25 стр.1;;;;;;;;;;;;;;;;;;;
ATM60457;Край Краснодарский Город Краснодар Улица Дзержинского Дом 100;;;;;;;;;;;;;;;;;;;
ATM60458;Город Санкт-Петербург Проспект Просвещения Дом 68, к. 1, литер A;;;;;;;;;;;;;;;;;;;
ATM60459;Область Новосибирская Город Новосибирск Улица Ватутина Дом 107;;;;;;;;;;;;;;;;;;;
ATM60460;Область Новосибирская Город Новосибирск Улица Ватутина Дом 107;;;;;;;;;;;;;;;;;;;
ATM60461;Область Новосибирская Город Новосибирск Улица Ватутина Дом 107;;;;;;;;;;;;;;;;;;;
ATM60462;Область Ростовская Город Новочеркасск Улица Ященко Дом 1 А;;;;;;;;;;;;;;;;;;;
ATM60465;Область Ростовская Район Аксайский Город Аксай Проспект Аксайский Дом 23;;;;;;;;;;;;;;;;;;;
ATM60467;Край Краснодарский Город Краснодар Улица Московская Дом 54;;;;;;;;;;;;;;;;;;;
ATM60480;Область Самарская Город Самара Шоссе Московское Дом 28;;;;;;;;;;;;;;;;;;;
ATM60481;Город Санкт-Петербург Улица Васи Алексеева Дом 6;;;;;;;;;;;;;;;;;;;
ATM60494;Город Санкт-Петербург Проспект Космонавтов Дом 45;;;;;;;;;;;;;;;;;;;
ATM60495;Город Санкт-Петербург Проспект Московский Дом 137;;;;;;;;;;;;;;;;;;;
ATM60497;Город Санкт-Петербург Шоссе Выборгское Дом 19;;;;;;;;;;;;;;;;;;;
ATM60500;Город Санкт-Петербург Проспект Большевиков Дом 10, корп. 1, лит. А;;;;;;;;;;;;;;;;;;;
ATM60501;Город Санкт-Петербург Улица Балканская М. Дом 27 А;;;;;;;;;;;;;;;;;;;
ATM60502;Город Санкт-Петербург Проспект Заневский Дом 65, к. 1, лит. А;;;;;;;;;;;;;;;;;;;
ATM60503;Город Санкт-Петербург Проспект Богатырский Дом 42;;;;;;;;;;;;;;;;;;;
ATM60504;Город Санкт-Петербург Шоссе Петергофское Дом 98;;;;;;;;;;;;;;;;;;;
ATM60505;Город Санкт-Петербург Площадь Конституции Дом 7;;;;;;;;;;;;;;;;;;;
ATM60510;Край Краснодарский Город Краснодар Улица Солнечная Дом 15/3;;;;;;;;;;;;;;;;;;;
ATM60523;Область Новосибирская Город Новосибирск Улица Советская Дом 5;;;;;;;;;;;;;;;;;;;
ATM60524;Область Ростовская Район Аксайский Поселок Верхнетемерницкий Улица Обсерваторная Дом 13;;;;;;;;;;;;;;;;;;;
ATM60525;Область Псковская Город Псков Проспект Октябрьский Дом 36;;;;;;;;;;;;;;;;;;;
ATM60526;Край Пермский Город Пермь Проспект Комсомольский Дом 77;;;;;;;;;;;;;;;;;;;
ATM60528;Область Брянская Город Клинцы Переулок Зайцева Дом 7;;;;;;;;;;;;;;;;;;;
ATM60538;Область Ростовская Город Ростов-на-Дону Бульвар Комарова Дом 24 А;;;;;;;;;;;;;;;;;;;
ATM60550;Область Саратовская Город Саратов Улица Большая Казачья Дом 49/65;;;;;;;;;;;;;;;;;;;
ATM60559;Область Липецкая Город Липецк Улица Механизаторов Дом 16;;;;;;;;;;;;;;;;;;;
ATM60562;Край Красноярский Район Казачинский Село Казачинское Улица Советская Дом 7-Л;;;;;;;;;;;;;;;;;;;
ATM60565;Область Московская Город Химки Микрорайон 8;;;;;;;;;;;;;;;;;;;
ATM60568;Город Москва Улица Станиславского Дом 21/5;;;;;;;;;;;;;;;;;;;
ATM60569;Область Московская Район Одинцовский Деревня Марфино Владение 110;;;;;;;;;;;;;;;;;;;
ATM60570;Город Москва Дорога МКАД 65 км;;;;;;;;;;;;;;;;;;;
ATM60572;Край Краснодарский Город Краснодар Улица Новороссийская Дом 230;;;;;;;;;;;;;;;;;;;
ATM60579;Город Москва Шоссе Энтузиастов Дом 12 к. 2;;;;;;;;;;;;;;;;;;;
ATM60580;Город Москва Дорога МКАД 24 км;;;;;;;;;;;;;;;;;;;
ATM60581;Область Московская Район Ленинский Поселок Совхоз им Ленина;;;;;;;;;;;;;;;;;;;
ATM61011;Область Курганская Город Курган Улица Ленина Дом 5;;;;;;;;;;;;;;;;;;;
ATM61021;Область Свердловская Город Екатеринбург Улица Комсомольская Дом 80;;;;;;;;;;;;;;;;;;;
ATM61024;Край Приморский Город Артем Улица Михайловская Дом 2;;;;;;;;;;;;;;;;;;;
ATM61036;Город Москва Проспект Севастопольский Дом 43/2 А;;;;;;;;;;;;;;;;;;;
ATM61038;Область Саратовская Город Саратов Проспект Энтузиастов Дом 57;;;;;;;;;;;;;;;;;;;
ATM61041;Область Самарская Город Самара Улица Стара Загора Дом 130;;;;;;;;;;;;;;;;;;;
ATM61042;"Область Ленинградская Район Ломоносовский Село Виллозское сельское поселение ""Офицерское село"" Дом Волхонское шоссе, квартал 1, д. 11, кор.3.";;;;;;;;;;;;;;;;;;;
ATM61044;Область Ленинградская Район Всеволожский Деревня Новое Девяткино Улица Главная Дом 60;;;;;;;;;;;;;;;;;;;
ATM61054;Край Пермский Город Пермь Улица Героев Хасана Дом 108;;;;;;;;;;;;;;;;;;;
ATM61055;Область Новгородская Город Великий Новгород Улица Ломоносова Дом 29;;;;;;;;;;;;;;;;;;;
ATM61057;Город Москва Бульвар Осенний Дом 9;;;;;;;;;;;;;;;;;;;
ATM61058;Город Москва Бульвар Осенний Дом 9;;;;;;;;;;;;;;;;;;;
ATM61059;Город Москва Проезд Южнопортовый 2-й Дом 18, стр. 9;;;;;;;;;;;;;;;;;;;
ATM61060;Область Московская Город Домодедово Шоссе Каширское Дом 70 пом. 4;;;;;;;;;;;;;;;;;;;
ATM61061;Область Курская Город Курск Улица Ленина Дом 94;;;;;;;;;;;;;;;;;;;
ATM61062;Область Оренбургская Город Оренбург Улица Новая Дом 4;;;;;;;;;;;;;;;;;;;
ATM61063;Область Московская Город Домодедово Шоссе Каширское Дом 70, пом. 4;;;;;;;;;;;;;;;;;;;
ATM61064;Республика Тыва Город Кызыл Улица Тувинских Добровольцев Дом 13;;;;;;;;;;;;;;;;;;;
ATM61066;Область Тюменская Город Тюмень Улица 50 лет Октября Дом 34/1;;;;;;;;;;;;;;;;;;;
ATM61069;Область Калининградская Город Калининград Улица Нарвская Дом 112;;;;;;;;;;;;;;;;;;;
ATM61071;Область Московская Район Солнечногорский Город Солнечногорск Территория Шерризон Строение 1;;;;;;;;;;;;;;;;;;;
ATM61075;Область Московская Район Орехово-Зуевский Город Ликино-Дулево Улица Ленина Дом 15;;;;;;;;;;;;;;;;;;;
ATM61076;Город Москва Улица Угличская Дом 12/1;;;;;;;;;;;;;;;;;;;
ATM61077;Область Тамбовская Город Тамбов Улица Интернациональная Дом 16-Б;;;;;;;;;;;;;;;;;;;
ATM61100;Область Московская Город Жуковский Улица Мичурина Дом 17;;;;;;;;;;;;;;;;;;;
ATM61107;Республика Башкортостан Район Кармаскалинский Деревня Кабаково Улица Шоссейная Дом 1/1;;;;;;;;;;;;;;;;;;;
ATM63000;Область Саратовская Город Энгельс Проспект Строителей Дом 39 в;;;;;;;;;;;;;;;;;;;
ATM64000;Город Санкт-Петербург Поселок Парголово Проспект Комендантский Дом 140;;;;;;;;;;;;;;;;;;;
ATM64001;Край Красноярский Город Норильск Площадь Гвардейская Дом 2;;;;;;;;;;;;;;;;;;;
ATM64002;Край Красноярский Район Березовский Рабочий поселок Березовка Улица Кирова Дом 73;;;;;;;;;;;;;;;;;;;
ATM64003;Край Красноярский Город Норильск Зона Талнахская обогатительная фабрика;;;;;;;;;;;;;;;;;;;
ATM64004;"Область Ленинградская Район Ломоносовский Село Виллозское сельское поселение ""Офицерское село"" Дом Волхонское шоссе, квартал 1, д. 11, кор.3.";;;;;;;;;;;;;;;;;;;
ATM64007;Область Воронежская Город Воронеж Улица Маршала Жукова Дом 15;;;;;;;;;;;;;;;;;;;
ATM64008;Край Красноярский Город Норильск Улица Бауманская Дом 8-А;;;;;;;;;;;;;;;;;;;
ATM64010;"Область Ленинградская Район Ломоносовский Село Виллозское сельское поселение ""Офицерское село"" Дом Волхонское шоссе, квартал 1, д. 11, кор.3.";;;;;;;;;;;;;;;;;;;
ATM64014;Область Тамбовская Поселок Строитель Улица Промышленная Дом 2;;;;;;;;;;;;;;;;;;;
ATM64015;Область Курганская Город Курган Улица Марии Ульяновой Дом 6;;;;;;;;;;;;;;;;;;;
ATM64016;Город Москва Переулок Лесной 4-й Дом 4;;;;;;;;;;;;;;;;;;;
ATM64017;Область Московская Район Подольский Деревня Софьино Владение 1/1;;;;;;;;;;;;;;;;;;;
ATM64018;Город Москва Проспект Нахимовский Дом 24;;;;;;;;;;;;;;;;;;;
ATM64019;Город Москва Деревня Крёкшино Улица Южная Дом 33;;;;;;;;;;;;;;;;;;;
ATM64020;Область Московская Район Красногорский Поселок городского типа Нахабино;;;;;;;;;;;;;;;;;;;
ATM64021;Край Краснодарский Город Краснодар Улица Стасова Дом 182;;;;;;;;;;;;;;;;;;;
ATM64022;Республика Башкортостан Район Стерлитамакский Город Стерлитамак Улица Техническая Дом 32;;;;;;;;;;;;;;;;;;;
ATM64023;Область Новосибирская Город Новосибирск Улица Дуси Ковальчук Дом 1/1;;;;;;;;;;;;;;;;;;;
ATM64024;Республика Коми Город Сыктывкар Проспект Октябрьский Дом 131/3;;;;;;;;;;;;;;;;;;;
ATM64025;Область Омская Город Омск Улица И.Н.Багнюка Дом 2;;;;;;;;;;;;;;;;;;;
ATM64026;Область Омская Город Омск Улица Некрасова Дом 1;;;;;;;;;;;;;;;;;;;
ATM64027;Область Московская Город Старая Купавна Улица Кирова Дом 29;;;;;;;;;;;;;;;;;;;
ATM64028;Город Москва Улица Ямская 2-я Дом 4;;;;;;;;;;;;;;;;;;;
ATM64029;Область Ростовская Город Ростов-на-Дону Улица Малиновского Дом 23д;;;;;;;;;;;;;;;;;;;
ATM64032;Область Московская Город Химки Улица Бурденко Дом 1;;;;;;;;;;;;;;;;;;;
ATM64033;Область Сахалинская Город Южно-Сахалинск Улица Бумажная Дом 26;;;;;;;;;;;;;;;;;;;
ATM64034;Город Москва Улица Маши Порываевой Дом 34;;;;;;;;;;;;;;;;;;;
ATM64035;Область Ленинградская Город Луга Улица Большая Заречная Дом 1А;;;;;;;;;;;;;;;;;;;
ATM64036;Область Самарская Город Тольятти Улица Коммунальная Дом 40;;;;;;;;;;;;;;;;;;;
ATM64037;Область Московская Район Орехово-Зуевский Деревня Давыдово Улица Заводская Дом 1;;;;;;;;;;;;;;;;;;;
ATM64038;Город Москва Улица Гурьянова Дом 83стр1;;;;;;;;;;;;;;;;;;;
ATM64039;Область Ульяновская Город Ульяновск Проезд Инженерный 30й Дом 5/1;;;;;;;;;;;;;;;;;;;
ATM64040;Область Московская Район Мытищинский Деревня Шолохово Километр 1-й  автодороги Шолохово-Федоскино Владение 4 стр 2;;;;;;;;;;;;;;;;;;;
ATM64041;Город Москва Улица Маши Порываевой Дом 34;;;;;;;;;;;;;;;;;;;
ATM64042;Область Самарская Город Самара Шоссе Московское (18 км) Дом А;;;;;;;;;;;;;;;;;;;
ATM64043;Город Москва Улица Гурьянова Дом 83стр1;;;;;;;;;;;;;;;;;;;
ATM64044;Область Волгоградская Город Волгоград Улица Томская Дом 7;;;;;;;;;;;;;;;;;;;
ATM64045;Область Московская Город Фрязино Улица Озерная Дом 1 А;;;;;;;;;;;;;;;;;;;
ATM64046;Республика Марий Эл Город Йошкар-Ола Проспект Воскресенский Дом 17;;;;;;;;;;;;;;;;;;;
ATM64047;Край Краснодарский Село Эсто-Садок Набережная Лаванда Дом 4;;;;;;;;;;;;;;;;;;;
ATM64049;Область Пензенская Город Пенза Улица Байдукова Дом 2;;;;;;;;;;;;;;;;;;;
ATM64050;Область Московская Район Мытищинский Деревня Шолохово Километр 1-й  автодороги Шолохово-Федоскино Владение 4 стр 2;;;;;;;;;;;;;;;;;;;
ATM64051;Область Нижегородская Город Нижний Новгород Улица Героя Шапошникова Дом 5/1;;;;;;;;;;;;;;;;;;;
ATM64052;Город Москва Проспект Волгоградский Дом 42  стр. Б2;;;;;;;;;;;;;;;;;;;
ATM64053;Город Москва Улица Южнопортовая Дом 5/7;;;;;;;;;;;;;;;;;;;
ATM64054;Город Москва Проезд Красногвардейский 1-й Дом 15;;;;;;;;;;;;;;;;;;;
ATM64055;Город Москва Проспект Ленинградский Дом 49;;;;;;;;;;;;;;;;;;;
ATM64056;Область Пензенская Город Пенза Улица Гагарина Дом 9;;;;;;;;;;;;;;;;;;;
ATM64057;Область Самарская Город Самара Проспект Кирова Дом 257;;;;;;;;;;;;;;;;;;;
ATM64058;Город Москва Улица Гурьянова Дом 83стр1;;;;;;;;;;;;;;;;;;;
ATM64059;Город Москва Улица Смольная Дом 24-Д;;;;;;;;;;;;;;;;;;;
ATM64062;Республика Татарстан Город Казань Улица Родины Дом 51;;;;;;;;;;;;;;;;;;;
ATM64064;Город Санкт-Петербург Проспект Маршала Жукова Дом 31 стр. 1;;;;;;;;;;;;;;;;;;;
ATM64065;Область Новосибирская Город Новосибирск Улица Сибиряков-Гвардейцев Дом 51/3;;;;;;;;;;;;;;;;;;;
ATM64066;Область Московская Район Домодедовский Город Домодедово Территория Аэропорт Домодедово Территория Строение 9;;;;;;;;;;;;;;;;;;;
ATM64067;Город Москва Улица Маши Порываевой Дом 34;;;;;;;;;;;;;;;;;;;
ATM64072;Область Мурманская Город Мурманск Проспект Ленина Дом 82;;;;;;;;;;;;;;;;;;;
ATM64073;Область Кемеровская Город Новокузнецк Улица Тольятти Дом 46А;;;;;;;;;;;;;;;;;;;
ATM64074;Область Вологодская Город Череповец Улица Верещагина Дом 45;;;;;;;;;;;;;;;;;;;
ATM64075;Область Нижегородская Город Нижний Новгород Улица Родионова Дом 192 к. 2;;;;;;;;;;;;;;;;;;;
ATM64076;Область Нижегородская Город Нижний Новгород Улица Родионова Дом 192 к. 2;;;;;;;;;;;;;;;;;;;
ATM64077;Город Москва Площадь Измайловская Дом 1;;;;;;;;;;;;;;;;;;;
ATM64078;Область Нижегородская Город Нижний Новгород Улица Советская Дом 18Б;;;;;;;;;;;;;;;;;;;
ATM64079;Республика Татарстан Город Казань Улица Николая Ершова Дом 29Б;;;;;;;;;;;;;;;;;;;
ATM64080;Республика Татарстан Город Набережные Челны Улица Татарстан Дом 9А;;;;;;;;;;;;;;;;;;;
ATM64081;Область Кемеровская Город Новокузнецк Улица Тольятти Дом 46А;;;;;;;;;;;;;;;;;;;
ATM64082;Область Нижегородская Город Выкса Улица Братьев Баташевых Дом 45;;;;;;;;;;;;;;;;;;;
ATM64083;Область Нижегородская Город Выкса Улица Ленина Дом 7;;;;;;;;;;;;;;;;;;;
ATM64084;Область Новосибирская Город Новосибирск Улица Кавалерийская Дом 9;;;;;;;;;;;;;;;;;;;
ATM64085;Область Волгоградская Город Волгоград Проспект им В.И. Ленина Дом 46;;;;;;;;;;;;;;;;;;;
ATM64086;Республика Башкортостан Район Уфимский Город Уфа Улица Цюрупы Дом 145;;;;;;;;;;;;;;;;;;;
ATM64087;Область Московская Район Мытищинский Деревня Шолохово Километр 1-й  автодороги Шолохово-Федоскино Владение 4 стр 2;;;;;;;;;;;;;;;;;;;
ATM64088;Область Свердловская Город Екатеринбург Улица Луначарского Дом 83;;;;;;;;;;;;;;;;;;;
ATM64089;Область Самарская Город Самара Проспект Кирова Дом 257;;;;;;;;;;;;;;;;;;;
ATM64090;Область Калужская Село Росва Территория индустриальный парк Росва;;;;;;;;;;;;;;;;;;;
ATM64091;Автономный округ Ханты-Мансийский Автономный округ - Югра Город Сургут Проспект Ленина Дом 51;;;;;;;;;;;;;;;;;;;
ATM64092;Автономный округ Ханты-Мансийский Автономный округ - Югра Город Сургут Проспект Ленина Дом 51;;;;;;;;;;;;;;;;;;;
ATM64093;Область Тульская Город Тула Улица Фрунзе Дом 7-A;;;;;;;;;;;;;;;;;;;
ATM64094;Область Волгоградская Город Волгоград Проспект им В.И.Ленина Дом 60;;;;;;;;;;;;;;;;;;;
ATM64095;Край Краснодарский Город Краснодар Улица Улица им Янковского Дом 169;;;;;;;;;;;;;;;;;;;
ATM64096;Город Москва Улица Маши Порываевой Дом 34;;;;;;;;;;;;;;;;;;;
ATM64097;Республика Тыва Город Кызыл Улица Тувинских Добровольцев Дом 10;;;;;;;;;;;;;;;;;;;
ATM64098;Город Москва Улица Большая Ордынка Дом 65;;;;;;;;;;;;;;;;;;;
ATM64099;Республика Башкортостан Район Уфимский Город Уфа Улица Маршала Жукова Дом 37;;;;;;;;;;;;;;;;;;;
ATM64100;Область Тамбовская Город Тамбов Улица Интернациональная Дом 16-Б;;;;;;;;;;;;;;;;;;;
ATM64101;Республика Башкортостан Район Стерлитамакский Город Стерлитамак Улица Бабушкина Дом 7;;;;;;;;;;;;;;;;;;;
ATM64102;Край Пермский Город Пермь Улица Героев Хасана Дом 106;;;;;;;;;;;;;;;;;;;
ATM64103;Город Санкт-Петербург Улица Караванная Дом 1;;;;;;;;;;;;;;;;;;;
ATM64104;Город Москва Улица Маши Порываевой Дом 34;;;;;;;;;;;;;;;;;;;
ATM64105;Республика Хакасия Город Абакан Улица Пушкина Дом 165;;;;;;;;;;;;;;;;;;;
ATM64106;Город Москва Улица Маши Порываевой Дом 34;;;;;;;;;;;;;;;;;;;
ATM64107;Город Москва Проспект Мира Дом 124-8;;;;;;;;;;;;;;;;;;;
ATM64108;Край Хабаровский Город Хабаровск Улица Ким-Ю-Чена Дом 26;;;;;;;;;;;;;;;;;;;
ATM64109;Область Липецкая Город Липецк Площадь Металлургов Дом 2;;;;;;;;;;;;;;;;;;;
ATM64111;Область Липецкая Город Липецк Площадь Металлургов Дом 2;;;;;;;;;;;;;;;;;;;
ATM64114;Город Москва Бульвар Яна Райниса Дом 4к1;;;;;;;;;;;;;;;;;;;
ATM64115;Область Тюменская Город Тюмень Улица Харьковская Дом 75/1;;;;;;;;;;;;;;;;;;;
ATM64116;Город Москва Улица Смольная Дом 22;;;;;;;;;;;;;;;;;;;
ATM64117;Город Санкт-Петербург Проспект Просвещения Дом 34А;;;;;;;;;;;;;;;;;;;
ATM64118;Город Москва Переулок Карманицкий Дом 9;;;;;;;;;;;;;;;;;;;
