ID Банкомата;Адрес строкой RU;;;;;;;;;;;;;;;;;;;
ATM54471;"Область Ленинградская Район Ломоносовский Село Виллозское сельское поселение ""Офицерское село"" Дом Волхонское шоссе, квартал 1, д. 11, кор.3.";;;;;;;;;;;;;;;;;;;
ATM54485;Область Нижегородская Город Дзержинск Проспект Чкалова Дом 23;;;;;;;;;;;;;;;;;;;
ATM54487;Область Саратовская Город Саратов Улица Дачная 3-я Дом 1;;;;;;;;;;;;;;;;;;;
ATM54488;Город Санкт-Петербург Проспект Ленинский Дом 161-А;;;;;;;;;;;;;;;;;;;
ATM54491;Город Санкт-Петербург Шоссе Выборгское Дом 11;;;;;;;;;;;;;;;;;;;
ATM54492;Область Тюменская Город Тюмень Улица Мельникайте Дом 125/2;;;;;;;;;;;;;;;;;;;
ATM54498;Край Красноярский Город Норильск Улица Школьная Дом 16;;;;;;;;;;;;;;;;;;;
ATM54502;Область Пензенская Город Пенза Улица Калинина Дом 93;;;;;;;;;;;;;;;;;;;
ATM54503;Республика Хакасия Город Саяногорск Микрорайон Интернациональный Дом 7А;;;;;;;;;;;;;;;;;;;
ATM54505;Область Белгородская Район Губкинский Город Губкин Улица Артема Дом 12;;;;;;;;;;;;;;;;;;;
ATM54506;Край Краснодарский Город Краснодар Улица Уральская Дом 79/2;;;;;;;;;;;;;;;;;;;
ATM54518;Область Ярославская Город Ярославль Улица Победы Дом 41;;;;;;;;;;;;;;;;;;;
ATM54533;"Область Московская Город Коломна Проспект Кирова Дом 15А	1";;;;;;;;;;;;;;;;;;;
ATM54543;Область Ивановская Город Иваново Шоссе Кохомское Дом 1;;;;;;;;;;;;;;;;;;;
ATM54545;Край Приморский Район Пограничный Село Сергеевка;;;;;;;;;;;;;;;;;;;
ATM54546;Край Приморский Район Октябрьский Поселок городского типа Липовцы;;;;;;;;;;;;;;;;;;;
ATM54547;Край Красноярский Город Красноярск Улица Урицкого Дом 94;;;;;;;;;;;;;;;;;;;
ATM54548;Край Красноярский Город Красноярск Проспект им газеты Красноярский Рабочий Дом 27 с.78;;;;;;;;;;;;;;;;;;;
ATM54557;Край Приморский Город Владивосток Поселок Трудовое Улица Лермонтова Дом 77;;;;;;;;;;;;;;;;;;;
ATM54560;Область Самарская Город Самара Проспект Кирова Дом 257;;;;;;;;;;;;;;;;;;;
ATM54561;Область Белгородская Город Белгород Переулок Карьерный 2-й Дом 12;;;;;;;;;;;;;;;;;;;
ATM54567;Область Тамбовская Город Тамбов Улица Советская Дом 198-Б;;;;;;;;;;;;;;;;;;;
ATM54569;Область Тамбовская Город Тамбов Улица Интернациональная Дом 16 Б;;;;;;;;;;;;;;;;;;;
ATM54571;Город Санкт-Петербург Набережная Обводного Канала Дом 118/7;;;;;;;;;;;;;;;;;;;
ATM54572;Город Санкт-Петербург Улица Бухарестская Дом 69-А;;;;;;;;;;;;;;;;;;;
ATM54573;Край Красноярский Город Норильск Проспект Ленинский Дом 11;;;;;;;;;;;;;;;;;;;
ATM54580;Край Забайкальский Город Чита Проспект Советов Дом 7;;;;;;;;;;;;;;;;;;;
ATM54582;Край Краснодарский Село Эсто-Садок Улица Олимпийская Дом 35;;;;;;;;;;;;;;;;;;;
ATM54705;Город Москва Рабочий поселок Ильинский Улица Ленинская Дом 38;;;;;;;;;;;;;;;;;;;
ATM54706;Область Белгородская Район Белгородский Поселок Дубовое Улица Щорса Дом 64;;;;;;;;;;;;;;;;;;;
ATM54709;Область Владимирская Город Вязники Улица Промышленная Дом 1;;;;;;;;;;;;;;;;;;;
ATM54711;Область Московская Район Красногорский Поселок городского типа Нахабино;;;;;;;;;;;;;;;;;;;
ATM54717;Город Москва Улица Неглинная Дом 4;;;;;;;;;;;;;;;;;;;
ATM54719;Область Мурманская Город Мончегорск Территория Промплощадка КГМК Дом Проходная Северная;;;;;;;;;;;;;;;;;;;
ATM54724;Область Кировская Город Киров Улица Пролетарская Дом 15;;;;;;;;;;;;;;;;;;;
ATM54744;Область Новосибирская Город Новосибирск Площадь Карла Маркса Дом 1/1;;;;;;;;;;;;;;;;;;;
ATM54757;Край Красноярский Город Красноярск Улица Курчатова Дом 15-Б;;;;;;;;;;;;;;;;;;;
ATM54764;Республика Бурятия Район Селенгинский Город Гусиноозерск Улица Ленина Дом 32-А;;;;;;;;;;;;;;;;;;;
ATM54772;Республика Карелия Город Петрозаводск Улица Ленинградская Дом 13;;;;;;;;;;;;;;;;;;;
ATM54774;Область Владимирская Район Александровский Город Александров Переулок Красный Дом 2;;;;;;;;;;;;;;;;;;;
ATM54776;Область Свердловская Город Екатеринбург Улица Блюхера Дом 41;;;;;;;;;;;;;;;;;;;
ATM54780;Область Ульяновская Город Ульяновск Проспект Ульяновский Дом 17а;;;;;;;;;;;;;;;;;;;
ATM54781;Область Саратовская Город Энгельс Площадь Ленина Дом 1;;;;;;;;;;;;;;;;;;;
ATM54782;Область Саратовская Город Саратов Проспект Энтузиастов Дом 57;;;;;;;;;;;;;;;;;;;
ATM54783;Область Свердловская Город Екатеринбург Улица Мамина-Сибиряка Дом 101;;;;;;;;;;;;;;;;;;;
ATM54792;Область Астраханская Город Астрахань Переулок Карла Маркса Дом 18;;;;;;;;;;;;;;;;;;;
ATM54795;Область Томская Район Томский Село Октябрьское Улица Заводская Дом 12;;;;;;;;;;;;;;;;;;;
ATM54796;Край Красноярский Город Красноярск Проспект 60 лет образования СССР Дом 5;;;;;;;;;;;;;;;;;;;
ATM54798;Область Астраханская Город Астрахань Улица Магистральная Дом 1;;;;;;;;;;;;;;;;;;;
ATM54800;Область Ленинградская Район Ломоносовский Территория Северная часть Горелово Шоссе Волхонское Дом 7/1;;;;;;;;;;;;;;;;;;;
ATM54801;Область Новосибирская Район Новосибирский Сельсовет Мочищенский , Мочище Дачный поселок Шоссе Краснояровское Дом 5;;;;;;;;;;;;;;;;;;;
ATM54804;Область Нижегородская Город Бор Улица Ленина Дом 113б;;;;;;;;;;;;;;;;;;;
ATM54805;Край Хабаровский Город Комсомольск-на-Амуре Улица Димитрова Дом 4;;;;;;;;;;;;;;;;;;;
ATM54806;Область Новгородская Город Великий Новгород Улица Тихвинская Дом 10а;;;;;;;;;;;;;;;;;;;
ATM54813;Край Хабаровский Город Амурск Проспект Мира Дом 14;;;;;;;;;;;;;;;;;;;
ATM54814;Республика Татарстан Город Казань Улица Дементьева Дом 22;;;;;;;;;;;;;;;;;;;
ATM54816;Город Москва Дорога МКАД 84 км Владение 3, стр. 1;;;;;;;;;;;;;;;;;;;
ATM54817;Область Тульская Город Тула Улица Фрунзе Дом 7-A;;;;;;;;;;;;;;;;;;;
ATM54818;Республика Саха /Якутия/ Город Нерюнгри Поселок городского типа Чульман Территория Аэропорт;;;;;;;;;;;;;;;;;;;
ATM54822;Республика Тыва Город Кызыл Улица Калинина Дом 5 А;;;;;;;;;;;;;;;;;;;
ATM54825;Край Пермский Город Пермь Проспект Комсомольский Дом 72;;;;;;;;;;;;;;;;;;;
ATM54826;Область Сахалинская Город Южно-Сахалинск Улица Чехова Дом 78;;;;;;;;;;;;;;;;;;;
ATM54827;Республика Тыва Город Кызыл Улица Ленина Дом 42;;;;;;;;;;;;;;;;;;;
ATM54831;Республика Калмыкия Город Элиста Улица Губаревича Дом 5;;;;;;;;;;;;;;;;;;;
ATM54838;Область Тульская Район Ленинский Деревня Варваровка Проезд Варваровский Дом 15;;;;;;;;;;;;;;;;;;;
ATM54844;Город Москва Проезд Багратионовский Дом 7;;;;;;;;;;;;;;;;;;;
ATM54854;Республика Хакасия Город Абакан Улица Аскизская Дом 155;;;;;;;;;;;;;;;;;;;
ATM54855;Республика Хакасия Город Абакан Улица Аскизская Дом 240;;;;;;;;;;;;;;;;;;;
ATM54861;Город Санкт-Петербург Проспект Большевиков Дом 27 А;;;;;;;;;;;;;;;;;;;
ATM54866;Край Приморский Город Фокино Улица Постникова Дом 7;;;;;;;;;;;;;;;;;;;
ATM54876;Республика Марий Эл Город Йошкар-Ола Улица Палантая Дом 63 В;;;;;;;;;;;;;;;;;;;
ATM54877;Край Приморский Район Черниговский Село Черниговка Улица Октябрьская Дом 75;;;;;;;;;;;;;;;;;;;
ATM54878;Область Саратовская Город Саратов Площадь Им Орджоникидзе Г.К. Дом 1;;;;;;;;;;;;;;;;;;;
ATM54882;Автономная область Еврейская Район Ленинский Село Ленинское Улица Кагыкина Дом 5;;;;;;;;;;;;;;;;;;;
ATM54893;Область Волгоградская Город Волгоград Проспект им В.И. Ленина Дом 46;;;;;;;;;;;;;;;;;;;
ATM54900;Край Красноярский Город Красноярск Улица Партизана Железняка Дом 1;;;;;;;;;;;;;;;;;;;
ATM54905;Область Новосибирская Город Новосибирск Проспект Красный Дом 161;;;;;;;;;;;;;;;;;;;
ATM54916;Край Хабаровский Город Хабаровск Улица Карла Маркса Дом 114;;;;;;;;;;;;;;;;;;;
ATM54917;Область Томская Город Томск Улица Ивана Черных Дом 96/1;;;;;;;;;;;;;;;;;;;
ATM54918;Область Ленинградская Район Всеволожский Город Всеволожск Шоссе Дорога Жизни 7-й км;;;;;;;;;;;;;;;;;;;
ATM54931;Область Иркутская Город Иркутск-45 Улица Молодежная Дом 10;;;;;;;;;;;;;;;;;;;
ATM54934;Край Красноярский Район Таймырский Долгано-Ненецкий Город Дудинка Улица Матросова Дом 14;;;;;;;;;;;;;;;;;;;
ATM54935;Область Астраханская Город Астрахань Улица Кубанская Дом 23/2;;;;;;;;;;;;;;;;;;;
ATM54939;Край Хабаровский Город Хабаровск Улица Суворова Дом 51;;;;;;;;;;;;;;;;;;;
ATM54941;Область Московская Район Домодедовский Город Домодедово Территория владение Склады 104 Строение 6/1;;;;;;;;;;;;;;;;;;;
ATM54942;Город Москва Улица Гурьянова Дом 83стр1;;;;;;;;;;;;;;;;;;;
ATM54951;Край Приморский Город Фокино Улица Клубная Дом 23;;;;;;;;;;;;;;;;;;;
ATM54952;Область Новосибирская Город Новосибирск Улица Нижегородская Дом 6;;;;;;;;;;;;;;;;;;;
ATM54954;Область Новосибирская Город Новосибирск Улица 25 лет октября Дом 22;;;;;;;;;;;;;;;;;;;
ATM54955;Область Астраханская Город Астрахань Улица Куйбышева Дом 69;;;;;;;;;;;;;;;;;;;
ATM54956;Область Рязанская Город Рязань Проспект Первомайский Дом 53/2;;;;;;;;;;;;;;;;;;;
ATM54957;Область Новгородская Город Великий Новгород Улица Большая Санкт-Петербургская Дом 39;;;;;;;;;;;;;;;;;;;
ATM54960;Республика Саха /Якутия/ Город Якутск Улица Дзержинского Дом 23;;;;;;;;;;;;;;;;;;;
ATM54962;Область Ростовская Город Ростов-на-Дону Улица Советская Дом 7/1;;;;;;;;;;;;;;;;;;;
ATM54968;Город Санкт-Петербург Улица Ярослава Гашека Дом 5;;;;;;;;;;;;;;;;;;;
ATM54969;Область Владимирская Город Владимир Улица Горького Дом 38А;;;;;;;;;;;;;;;;;;;
ATM54970;Область Иркутская Город Иркутск Улица Трактовая Дом 14Б;;;;;;;;;;;;;;;;;;;
ATM54972;Республика Тыва Город Кызыл Улица Бай-Хаакская Дом 1;;;;;;;;;;;;;;;;;;;
ATM54975;Область Тамбовская Город Мичуринск Улица Филиппова Дом 72;;;;;;;;;;;;;;;;;;;
ATM54977;Область Томская Район Чаинский Село Усть-Бакчар Улица Центральная Дом 38;;;;;;;;;;;;;;;;;;;
ATM54983;Область Челябинская Город Челябинск Улица Энгельса Дом 79;;;;;;;;;;;;;;;;;;;
ATM54985;Край Приморский Город Владивосток Улица Фадеева Дом 30;;;;;;;;;;;;;;;;;;;
ATM54988;Край Приморский Город Владивосток Улица Шуйская Дом 23-А;;;;;;;;;;;;;;;;;;;
ATM55025;Город Москва Шоссе Рублевское Дом 62;;;;;;;;;;;;;;;;;;;
ATM55028;Край Ставропольский Город Пятигорск Улица Теплосерная Дом 21а;;;;;;;;;;;;;;;;;;;
ATM55029;Область Томская Город Томск Проспект Ленина Дом 166;;;;;;;;;;;;;;;;;;;
ATM55037;Край Приморский Город Владивосток Улица Воропаева Дом 5;;;;;;;;;;;;;;;;;;;
ATM55040;Край Приморский Город Артем Улица Лазо Дом 44;;;;;;;;;;;;;;;;;;;
ATM55066;Область Брянская Город Брянск Улица Фокина Дом 108-А;;;;;;;;;;;;;;;;;;;
ATM55067;Город Москва Улица Гурьянова Дом 83стр1;;;;;;;;;;;;;;;;;;;
ATM55075;Область Московская Район Домодедовский Город Домодедово Деревня Чурилково Дом 7г;;;;;;;;;;;;;;;;;;;
ATM55077;Город Санкт-Петербург Проспект Ветеранов Дом 122;;;;;;;;;;;;;;;;;;;
ATM55081;Край Приморский Город Владивосток Улица Дальзаводская Дом 2 к. 4;;;;;;;;;;;;;;;;;;;
ATM55085;Область Новгородская Город Великий Новгород Улица Федоровский Ручей Дом 2/13;;;;;;;;;;;;;;;;;;;
ATM55090;Край Красноярский Город Норильск;;;;;;;;;;;;;;;;;;;
ATM55091;Край Красноярский Город Норильск Территория Рудник Таймырский;;;;;;;;;;;;;;;;;;;
ATM55092;Область Саратовская Город Вольск Улица Октябрьская Дом 108;;;;;;;;;;;;;;;;;;;
ATM55096;Область Новосибирская Город Новосибирск Улица Ползунова Дом 15 корп 1;;;;;;;;;;;;;;;;;;;
ATM55202;Город Москва Набережная Пресненская Дом 6 стр. 2;;;;;;;;;;;;;;;;;;;
ATM55228;Город Москва Шоссе Варшавское Дом 25 А стр.6;;;;;;;;;;;;;;;;;;;
ATM55238;Край Приморский Город Владивосток Проспект Красного Знамени Дом 91;;;;;;;;;;;;;;;;;;;
ATM55371;Край Хабаровский Район Вяземский Город Вяземский Улица Коммунистическая Дом 3;;;;;;;;;;;;;;;;;;;
ATM55384;Республика Калмыкия Город Элиста Улица Сухэ-Батора Дом 2;;;;;;;;;;;;;;;;;;;
ATM55396;Край Хабаровский Город Комсомольск-на-Амуре Улица Вагонная Дом 30;;;;;;;;;;;;;;;;;;;
ATM55405;Область Смоленская Город Смоленск Улица Тенишевой Дом 33;;;;;;;;;;;;;;;;;;;
ATM55409;Область Кемеровская Город Кемерово Проспект Ленинградский Дом 28 б;;;;;;;;;;;;;;;;;;;
ATM55411;Область Кемеровская Город Новокузнецк Улица Слесарная Дом 1а;;;;;;;;;;;;;;;;;;;
ATM55413;Республика Тыва Город Кызыл Улица Оюна Курседи Дом 159 А;;;;;;;;;;;;;;;;;;;
ATM55414;Республика Тыва Город Кызыл Улица Калинина Дом 10 а;;;;;;;;;;;;;;;;;;;
ATM55636;Область Белгородская Город Белгород Проспект Б.Хмельницкого Дом 111;;;;;;;;;;;;;;;;;;;
ATM55637;Республика Саха /Якутия/ Город Якутск Улица Ярославского Дом 37;;;;;;;;;;;;;;;;;;;
ATM55638;Город Москва Набережная Пресненская Дом 6 стр. 2;;;;;;;;;;;;;;;;;;;
ATM55640;Край Красноярский Город Норильск Улица Ленинградская Дом 3 Б;;;;;;;;;;;;;;;;;;;
ATM55641;Край Красноярский Город Норильск Улица Вокзальная Дом 28Г;;;;;;;;;;;;;;;;;;;
ATM55642;Край Красноярский Город Норильск Проспект Ленинский Дом 11;;;;;;;;;;;;;;;;;;;
ATM55643;Край Красноярский Город Норильск Улица Талнахская Дом 47;;;;;;;;;;;;;;;;;;;
ATM55906;Республика Тыва Город Кызыл Улица Калинина Дом 124 А;;;;;;;;;;;;;;;;;;;
ATM55907;Республика Тыва Город Кызыл Улица Ленина Дом 36;;;;;;;;;;;;;;;;;;;
ATM55908;Край Красноярский Город Красноярск Улица Ленина Дом 125;;;;;;;;;;;;;;;;;;;
ATM55918;Край Приморский Город Владивосток Улица Светланская Дом 106;;;;;;;;;;;;;;;;;;;
ATM55929;Город Москва Улица Таганская Дом 29 стр. 1;;;;;;;;;;;;;;;;;;;
ATM55930;Область Иркутская Город Иркутск Улица 3 Июля Дом 25;;;;;;;;;;;;;;;;;;;
ATM55931;Область Тамбовская Город Тамбов Улица Державинская Дом 28-13;;;;;;;;;;;;;;;;;;;
ATM55934;Республика Бурятия Район Закаменский Город Закаменск Улица Ленина Дом 23;;;;;;;;;;;;;;;;;;;
ATM55936;Область Астраханская Город Астрахань Улица Мелиоративная Дом 2;;;;;;;;;;;;;;;;;;;
ATM55938;Республика Калмыкия Город Элиста Микрорайон 1-й Дом 18;;;;;;;;;;;;;;;;;;;
ATM55941;Край Пермский Город Пермь Улица Мира Дом 41/1;;;;;;;;;;;;;;;;;;;
ATM55942;Область Томская Город Томск Улица Нахимова Дом 8/2;;;;;;;;;;;;;;;;;;;
ATM55951;Область Ростовская Город Ростов-на-Дону Улица Пойменная Дом 1;;;;;;;;;;;;;;;;;;;
ATM55955;Область Ивановская Город Иваново Улица Лежневская Дом 55;;;;;;;;;;;;;;;;;;;
ATM55960;Область Пензенская Город Пенза Улица Красная Дом 40;;;;;;;;;;;;;;;;;;;
ATM55963;Край Хабаровский Район Ванинский Поселок Монгохто Военная часть 40689;;;;;;;;;;;;;;;;;;;
ATM55968;Край Приморский Город Артем Улица Рабочая 1-я Дом 70;;;;;;;;;;;;;;;;;;;
ATM55970;Область Томская Город Томск Улица Пушкина Дом 63стр10;SLM расширенн.;Да;Пн-Пт 9:00 - 21:00;Lanit;Lanit;Владивосток;;;;;;;;;;;;;
ATM56001;Область Московская Район Мытищинский Деревня Шолохово Километр 1-й  автодороги Шолохово-Федоскино Владение 4 стр 2;;;;;;;;;;;;;;;;;;;
ATM56010;Край Хабаровский Город Хабаровск Улица Суворова Дом 25;;;;;;;;;;;;;;;;;;;
ATM56011;Край Хабаровский Город Хабаровск Улица Трехгорная Дом 98;;;;;;;;;;;;;;;;;;;
ATM56012;Область Тверская Город Тверь Улица Бебеля Дом 1;;;;;;;;;;;;;;;;;;;
ATM56021;Республика Саха /Якутия/ Улус Мирнинский Город Мирный Проспект Ленинградский Дом 19;;;;;;;;;;;;;;;;;;;
ATM56027;Город Москва Улица Академика Королева Дом 19;;;;;;;;;;;;;;;;;;;
ATM56031;Край Красноярский Город Красноярск Улица 30 Июля Дом 8;;;;;;;;;;;;;;;;;;;
ATM56035;"Город Москва Шоссе Каширское Дом 26	3";;;;;;;;;;;;;;;;;;;
ATM56038;Республика Калмыкия Город Элиста Улица Ленина В.И. Дом 249;;;;;;;;;;;;;;;;;;;
ATM56039;Край Красноярский Город Красноярск Проспект Мира Дом 19;;;;;;;;;;;;;;;;;;;
ATM56042;Область Самарская Город Самара Шоссе Московское (24 км) Дом 5;;;;;;;;;;;;;;;;;;;
ATM56043;Край Забайкальский Город Чита Улица Трактовая Дом 35 Б;;;;;;;;;;;;;;;;;;;
ATM56046;Область Самарская Город Самара Шоссе Московское (24 км) Дом 5;;;;;;;;;;;;;;;;;;;
ATM56047;Край Красноярский Город Красноярск Улица 9 Мая Дом 77;;;;;;;;;;;;;;;;;;;
ATM56048;Край Красноярский Город Норильск Улица Красноярская Дом 6;;;;;;;;;;;;;;;;;;;
ATM56051;Область Тверская Город Тверь Переулок Смоленский Дом 9;;;;;;;;;;;;;;;;;;;
ATM56052;Область Орловская Район Орловский Город Орел Шоссе Наугорское Дом 5;;;;;;;;;;;;;;;;;;;
ATM56057;Область Пензенская Город Пенза Улица Центральная Дом 1;;;;;;;;;;;;;;;;;;;
ATM56059;Область Пензенская Город Пенза Проспект Строителей Дом 90;;;;;;;;;;;;;;;;;;;
ATM56061;Область Астраханская Город Астрахань Улица Боевая Дом 25;;;;;;;;;;;;;;;;;;;
ATM56062;Край Пермский Город Пермь Улица Куйбышева Дом 85а;;;;;;;;;;;;;;;;;;;
ATM56064;Республика Хакасия Город Саяногорск Микрорайон Енисейский Дом 38;;;;;;;;;;;;;;;;;;;
ATM56066;Край Пермский Город Пермь Проспект Комсомольский Дом 72;;;;;;;;;;;;;;;;;;;
ATM56067;Область Смоленская Город Смоленск Улица 25 Сентября Дом 35-а;;;;;;;;;;;;;;;;;;;
ATM56070;Область Кемеровская Город Новокузнецк Проспект Авиаторов Дом 9;;;;;;;;;;;;;;;;;;;
ATM56071;Край Краснодарский Город Краснодар Улица Олимпийская / им. Тургенева Дом 8/135/1;;;;;;;;;;;;;;;;;;;
ATM56072;Автономная область Еврейская Город Биробиджан Улица Советская Дом 58;;;;;;;;;;;;;;;;;;;
ATM56077;Край Приморский Город Владивосток Улица Калинина Дом 204 б;;;;;;;;;;;;;;;;;;;
ATM56078;Область Иркутская Город Иркутск Улица Седова Дом 38/1;;;;;;;;;;;;;;;;;;;
