ID Банкомата;Адрес строкой RU;;;;;;;;;;;;;;;;;;;
ATM70345;Область Нижегородская Город Нижний Новгород Проспект Ленина Дом 93;;;;;;;;;;;;;;;;;;;
ATM70349;Область Тюменская Город Тюмень Улица Ямская Дом 76;;;;;;;;;;;;;;;;;;;
ATM70350;Край Красноярский Город Красноярск Улица Копылова Дом 72;;;;;;;;;;;;;;;;;;;
ATM70356;Область Тульская Район Новомосковский Город Новомосковск Улица Комсомольская Дом 38/15;;;;;;;;;;;;;;;;;;;
ATM70357;Область Свердловская Город Екатеринбург Улица Хохрякова Дом 41;;;;;;;;;;;;;;;;;;;
ATM70360;Город Москва Бульвар Дмитрия Донского Дом 2к1;;;;;;;;;;;;;;;;;;;
ATM70362;Край Красноярский Район Минусинский Село Тесь Улица Солнечная Дом 2;;;;;;;;;;;;;;;;;;;
ATM70364;Край Красноярский Город Минусинск Улица Мартьянова Дом 40;;;;;;;;;;;;;;;;;;;
ATM70368;Область Ульяновская Город Ульяновск Улица Дворцовая Дом 7А;;;;;;;;;;;;;;;;;;;
ATM70369;Область Томская Город Томск Улица Нахимова Дом 15;;;;;;;;;;;;;;;;;;;
ATM70372;Область Оренбургская Город Оренбург Улица Салмышская Дом 17;;;;;;;;;;;;;;;;;;;
ATM70375;Республика Бурятия Город Улан-Удэ Улица Терешковой Дом 3-Б;;;;;;;;;;;;;;;;;;;
ATM70381;Область Томская Город Томск Проспект Ленина Дом 111;;;;;;;;;;;;;;;;;;;
ATM70382;Область Томская Район Кожевниковский Село Кожевниково Улица Гагарина Дом 17;;;;;;;;;;;;;;;;;;;
ATM70384;Область Пензенская Город Пенза Улица Беляева Дом 14-A;;;;;;;;;;;;;;;;;;;
ATM70388;Республика Бурятия Город Улан-Удэ Проспект 50-летия Октября Проспект Дом 27;;;;;;;;;;;;;;;;;;;
ATM70390;Область Оренбургская Город Оренбург Улица Аксакова Дом 8;;;;;;;;;;;;;;;;;;;
ATM70391;Край Хабаровский Район Охотский Село Булгин Улица Центральная Дом 11;;;;;;;;;;;;;;;;;;;
ATM70395;Город Санкт-Петербург Улица Савушкина Дом 118;;;;;;;;;;;;;;;;;;;
ATM70397;Город Санкт-Петербург Набережная Грибоедова Канала Дом 13;;;;;;;;;;;;;;;;;;;
ATM70399;Область Оренбургская Город Оренбург Улица Аксакова Дом 8;;;;;;;;;;;;;;;;;;;
ATM70405;Область Нижегородская Город Нижний Новгород Улица Героя Шапошникова Дом 5/1;;;;;;;;;;;;;;;;;;;
ATM70406;Область Томская Город Томск Улица Смирнова Дом 9;;;;;;;;;;;;;;;;;;;
ATM70414;Область Нижегородская Город Нижний Новгород Улица Героя Шапошникова Дом 5/7;;;;;;;;;;;;;;;;;;;
ATM70420;Область Волгоградская Город Волгоград Улица Коммунистическая Дом 10;;;;;;;;;;;;;;;;;;;
ATM70443;Область Новосибирская Город Новосибирск Улица Богдана Хмельницкого Дом 125\1;;;;;;;;;;;;;;;;;;;
ATM70446;Область Томская Город Томск Площадь Ленина Дом 217;;;;;;;;;;;;;;;;;;;
ATM70447;Край Красноярский Город Красноярск Улица Партизана Железняка Дом 35А;;;;;;;;;;;;;;;;;;;
ATM70476;Край Красноярский Город Минусинск Улица Ленина Дом 92;;;;;;;;;;;;;;;;;;;
ATM70478;Область Новосибирская Город Новосибирск Проспект Красный Дом 1;;;;;;;;;;;;;;;;;;;
ATM70486;Край Красноярский Город Ачинск Микрорайон 7-й Дом 13;;;;;;;;;;;;;;;;;;;
ATM70487;Край Красноярский Город Красноярск Проспект Мира Дом 82;;;;;;;;;;;;;;;;;;;
ATM70497;Область Кировская Город Киров Улица Воровского Дом 119;;;;;;;;;;;;;;;;;;;
ATM70500;Область Волгоградская Город Волгоград Бульвар 30-летия Победы Дом 16;;;;;;;;;;;;;;;;;;;
ATM70501;Край Краснодарский Город Сочи Улица Конституции Дом 18;;;;;;;;;;;;;;;;;;;
ATM70502;Область Орловская Район Орловский Город Орел Улица Комсомольская Дом 140;;;;;;;;;;;;;;;;;;;
ATM70504;Область Московская Район Ногинский Город Ногинск Улица Советская Дом 64;;;;;;;;;;;;;;;;;;;
ATM70505;Область Ульяновская Город Ульяновск Улица Дворцовая Дом 7А;;;;;;;;;;;;;;;;;;;
ATM70507;Область Кировская Город Киров Улица Воровского Дом 119;;;;;;;;;;;;;;;;;;;
ATM70508;Чувашия Чувашская Республика - Город Чебоксары Улица Спиридона Михайлова Дом 1;;;;;;;;;;;;;;;;;;;
ATM70525;Чувашия Чувашская Республика - Город Чебоксары Улица Спиридона Михайлова Дом 1;;;;;;;;;;;;;;;;;;;
ATM70528;Область Воронежская Город Воронеж Проспект Московский Дом 9а;;;;;;;;;;;;;;;;;;;
ATM70533;Край Краснодарский Город Геленджик Улица Курзальная Дом 40а;;;;;;;;;;;;;;;;;;;
ATM70535;Область Астраханская Город Астрахань Проспект Бумажников Дом 12-А;;;;;;;;;;;;;;;;;;;
ATM70537;Область Тульская Город Тула Улица Фрунзе Дом 7-A;;;;;;;;;;;;;;;;;;;
ATM70544;Область Омская Город Омск Улица Лизы Чайкиной Дом 1;;;;;;;;;;;;;;;;;;;
ATM70548;"Область Омская Город Омск Улица Гусарова Дом 45	1";;;;;;;;;;;;;;;;;;;
ATM70552;Область Новосибирская Город Новосибирск Улица Богдана Хмельницкого Дом 39;;;;;;;;;;;;;;;;;;;
ATM70553;Область Нижегородская Город Нижний Новгород Площадь Революции Дом 9;;;;;;;;;;;;;;;;;;;
ATM70558;Область Воронежская Город Воронеж Проспект Революции Дом 37;;;;;;;;;;;;;;;;;;;
ATM70559;Край Краснодарский Город Краснодар Улица Солнечная Дом 18/3;;;;;;;;;;;;;;;;;;;
ATM70561;Область Курская Город Курск Проспект Кулакова Дом 9;;;;;;;;;;;;;;;;;;;
ATM70562;Область Пензенская Город Пенза Улица Пенза-5 Дом 20;;;;;;;;;;;;;;;;;;;
ATM70564;Область Кемеровская Город Кемерово Улица Красноармейская Дом 120;;;;;;;;;;;;;;;;;;;
ATM70566;Область Астраханская Город Астрахань Улица Заводская Дом 54;;;;;;;;;;;;;;;;;;;
ATM70568;Область Воронежская Город Воронеж Улица Арзамасская Дом 2;;;;;;;;;;;;;;;;;;;
ATM70569;Область Свердловская Город Екатеринбург Улица Амундсена Дом 65;;;;;;;;;;;;;;;;;;;
ATM70571;Край Краснодарский Город Краснодар Улица Рашпилевская Дом 325;;;;;;;;;;;;;;;;;;;
ATM70573;Республика Тыва Город Кызыл Улица Кочетова Дом 35;;;;;;;;;;;;;;;;;;;
ATM70576;Республика Бурятия Город Улан-Удэ Улица Терешковой Дом 3-Б;;;;;;;;;;;;;;;;;;;
ATM70577;Республика Тыва Город Кызыл Улица Тувинских Добровольцев Дом 10;;;;;;;;;;;;;;;;;;;
ATM70579;Край Красноярский Район Енисейский Рабочий поселок Подтесово Улица Калинина Дом 2;;;;;;;;;;;;;;;;;;;
ATM70587;Область Курская Город Курск Улица Ленина Дом 94;;;;;;;;;;;;;;;;;;;
ATM70591;Край Красноярский Город Красноярск Улица Воронова Дом 18;;;;;;;;;;;;;;;;;;;
ATM70597;Город Санкт-Петербург Проспект Гражданский Дом 11;;;;;;;;;;;;;;;;;;;
ATM70598;Республика Тыва Город Кызыл Улица Калинина Дом 3/2;;;;;;;;;;;;;;;;;;;
ATM70599;Область Брянская Город Брянск Улица Фокина Дом 108-А;;;;;;;;;;;;;;;;;;;
ATM70601;Край Ставропольский Город Ставрополь Улица Мира Дом 310;;;;;;;;;;;;;;;;;;;
ATM70607;Область Пензенская Город Пенза Улица Антонова Дом 7;;;;;;;;;;;;;;;;;;;
ATM70613;Область Астраханская Город Астрахань Улица К.Маркса Дом 18;;;;;;;;;;;;;;;;;;;
ATM70621;Область Смоленская Город Смоленск Проспект Гагарина Дом 10/2;;;;;;;;;;;;;;;;;;;
ATM70625;Республика Карелия Город Петрозаводск Проспект Ленина Дом 15;;;;;;;;;;;;;;;;;;;
ATM70628;Область Пензенская Город Пенза Улица Плеханова Дом 19;;;;;;;;;;;;;;;;;;;
ATM70629;Область Самарская Город Тольятти Шоссе Автозаводское Дом 6;;;;;;;;;;;;;;;;;;;
ATM70642;Область Самарская Город Самара Улица Аэродромная Дом 47;;;;;;;;;;;;;;;;;;;
ATM70643;Область Саратовская Город Саратов Улица Тархова Дом 29-Б;;;;;;;;;;;;;;;;;;;
ATM70644;Область Амурская Город Благовещенск Улица Ленина Дом 159;;;;;;;;;;;;;;;;;;;
ATM70645;Область Амурская Город Зея Микрорайон Светлый Дом 97;;;;;;;;;;;;;;;;;;;
ATM70646;Область Амурская Город Белогорск Улица Кирова Дом 68;;;;;;;;;;;;;;;;;;;
ATM70650;Область Саратовская Город Саратов Проспект 50 лет Октября Дом 70;;;;;;;;;;;;;;;;;;;
ATM70652;Город Москва Улица Авиамоторная Дом 12;;;;;;;;;;;;;;;;;;;
ATM70654;Область Пензенская Город Пенза Улица Суворова Дом 145-А;;;;;;;;;;;;;;;;;;;
ATM70660;Край Хабаровский Город Хабаровск Квартал ДОС (Большой Аэродром) Дом 51;;;;;;;;;;;;;;;;;;;
ATM70662;Область Псковская Город Псков Проспект Октябрьский Дом 36;;;;;;;;;;;;;;;;;;;
ATM70666;Край Хабаровский Город Хабаровск Улица Муравьева-Амурского Дом 23;;;;;;;;;;;;;;;;;;;
ATM70667;Область Магаданская Город Магадан Улица Болдырева Дом 6;;;;;;;;;;;;;;;;;;;
ATM70669;Край Забайкальский Город Чита Улица Николая Островского Дом 61;;;;;;;;;;;;;;;;;;;
ATM70671;Край Забайкальский Город Чита Улица Бутина Дом 2;;;;;;;;;;;;;;;;;;;
ATM70672;Край Забайкальский Город Чита Улица Красной Звезды Дом 58;;;;;;;;;;;;;;;;;;;
ATM70684;Край Забайкальский Город Чита Улица Амурская Дом 88;;;;;;;;;;;;;;;;;;;
ATM70685;Область Кировская Город Киров Улица Комсомольская Дом 30А;;;;;;;;;;;;;;;;;;;
ATM70687;Область Омская Город Омск Улица Красный Путь Дом 75;;;;;;;;;;;;;;;;;;;
ATM70689;Область Ивановская Город Иваново Улица Варенцовой Дом 9/18;;;;;;;;;;;;;;;;;;;
ATM70690;Область Рязанская Город Рязань Улица Ленина Дом 16/65;;;;;;;;;;;;;;;;;;;
ATM70713;Город Москва Улица Пятницкая Дом 2/38-2;;;;;;;;;;;;;;;;;;;
ATM70714;Область Иркутская Город Иркутск Улица Академическая Дом 31;;;;;;;;;;;;;;;;;;;
ATM70716;Область Амурская Город Райчихинск Улица Музыкальная Дом 27;;;;;;;;;;;;;;;;;;;
ATM70720;Край Хабаровский Город Комсомольск-на-Амуре Проспект Мира Дом 26;;;;;;;;;;;;;;;;;;;
ATM70722;Область Омская Город Омск Улица Куйбышева Дом 26;;;;;;;;;;;;;;;;;;;
ATM70725;Край Хабаровский Город Хабаровск Улица Суворова Дом 32;;;;;;;;;;;;;;;;;;;
ATM70726;Край Приморский Город Владивосток Улица Уборевича Дом 11;;;;;;;;;;;;;;;;;;;
ATM70728;Край Приморский Город Владивосток Улица Сахалинская Дом 42 стр 5;;;;;;;;;;;;;;;;;;;
ATM70737;Автономная область Еврейская Район Ленинский Село Бабстово Улица Садовая Дом 1а;;;;;;;;;;;;;;;;;;;
ATM70745;Республика Тыва Город Кызыл Улица Московская Дом 98;;;;;;;;;;;;;;;;;;;
ATM70752;Республика Тыва Город Кызыл Улица Дружбы Дом 21-А;;;;;;;;;;;;;;;;;;;
ATM70759;Край Забайкальский Город Чита Улица Журавлева Дом 79;;;;;;;;;;;;;;;;;;;
ATM70760;Край Забайкальский Город Чита Улица Горького Дом 36;;;;;;;;;;;;;;;;;;;
ATM70763;Область Калужская Район Малоярославецкий Город Малоярославец Улица Радищева Дом 8;;;;;;;;;;;;;;;;;;;
ATM70774;Область Архангельская Город Архангельск Территория Аэропорт Архангельск Дом 3, корп. 4;;;;;;;;;;;;;;;;;;;
ATM70786;Край Приморский Город Артем Улица Фрунзе Дом 52;;;;;;;;;;;;;;;;;;;
ATM70787;Край Приморский Город Владивосток Улица Калинина Дом 275;;;;;;;;;;;;;;;;;;;
ATM70788;Область Пензенская Город Пенза Улица Карпинского Дом 48;;;;;;;;;;;;;;;;;;;
ATM70795;Область Ивановская Город Иваново Улица Постышева Дом 57;;;;;;;;;;;;;;;;;;;
ATM70798;Область Новгородская Город Великий Новгород Улица Зелинского Дом 9-Б;;;;;;;;;;;;;;;;;;;
ATM70799;Край Забайкальский Город Чита Улица Горького Дом 43;;;;;;;;;;;;;;;;;;;
ATM70800;Край Хабаровский Город Хабаровск Улица Карла Маркса Дом 76;;;;;;;;;;;;;;;;;;;
ATM70808;Город Москва Город Зеленоград Аллея Сосновая Корпус 601;;;;;;;;;;;;;;;;;;;
ATM70812;Область Новгородская Город Великий Новгород Улица Большая Санкт-Петербургская Дом 16;;;;;;;;;;;;;;;;;;;
ATM70814;Республика Бурятия Город Улан-Удэ Проспект им 50-летия Октября Дом 28;;;;;;;;;;;;;;;;;;;
ATM70815;Край Хабаровский Город Хабаровск Улица Сергеевская Дом 26;;;;;;;;;;;;;;;;;;;
ATM70817;Область Томская Город Томск Улица Беринга Дом 10;;;;;;;;;;;;;;;;;;;
ATM70818;Область Томская Город Томск Улица Белинского Дом 63;;;;;;;;;;;;;;;;;;;
ATM70820;Республика Бурятия Город Улан-Удэ Улица Строителей Дом 17;;;;;;;;;;;;;;;;;;;
ATM70822;Республика Бурятия Город Улан-Удэ Улица Жердева Дом 104;;;;;;;;;;;;;;;;;;;
ATM70823;Область Томская Город Томск Поселок Предтеченск Улица Мелиоративная Дом 5/2;;;;;;;;;;;;;;;;;;;
ATM70824;Область Московская Город Дубна Улица Советская Дом 17;;;;;;;;;;;;;;;;;;;
ATM70825;Область Амурская Город Благовещенск Улица Нагорная Дом 19;;;;;;;;;;;;;;;;;;;
ATM70836;Республика Бурятия Город Улан-Удэ Улица Шумяцкого Дом 3А;;;;;;;;;;;;;;;;;;;
ATM70838;Область Иркутская Город Иркутск Улица Трактовая Дом 14Б;;;;;;;;;;;;;;;;;;;
ATM70848;Край Хабаровский Город Хабаровск Шоссе Матвеевское Дом 28Б;;;;;;;;;;;;;;;;;;;
ATM70849;Область Амурская Город Благовещенск Улица Амурская Дом 187;;;;;;;;;;;;;;;;;;;
ATM70855;Край Приморский Район Пожарский Поселок городского типа Лучегорск;;;;;;;;;;;;;;;;;;;
ATM70858;Область Томская Район Кожевниковский Село Кожевниково Улица Калинина Дом 70/1 стр.16;;;;;;;;;;;;;;;;;;;
ATM70860;Край Красноярский Город Красноярск Проезд Транспортный Дом 1;;;;;;;;;;;;;;;;;;;
ATM70861;Республика Хакасия Район Усть-Абаканский Поселок городского типа Усть-Абакан Улица Карла Маркса Дом 11 а;;;;;;;;;;;;;;;;;;;
ATM70862;Область Челябинская Город Челябинск Улица Артиллерийская Дом 136;;;;;;;;;;;;;;;;;;;
ATM70864;Город Москва Улица Обручева Дом 30/1 стр.1;;;;;;;;;;;;;;;;;;;
ATM70866;Край Алтайский Город Барнаул Улица Попова Дом 86;;;;;;;;;;;;;;;;;;;
ATM70873;Республика Тыва Город Кызыл Улица Ленина Дом 26-А;;;;;;;;;;;;;;;;;;;
ATM70876;Область Ростовская Город Ростов-на-Дону Улица Менжинского Дом 2/13/1;;;;;;;;;;;;;;;;;;;
ATM70882;Автономная область Еврейская Город Биробиджан Улица Трансформаторная Дом 3А;;;;;;;;;;;;;;;;;;;
ATM70890;Город Москва Бульвар Дмитрия Донского Дом 2к1;;;;;;;;;;;;;;;;;;;
ATM70894;Край Хабаровский Район Хабаровский Село Анастасьевка Улица Интернациональная Дом 6;;;;;;;;;;;;;;;;;;;
ATM70896;Область Волгоградская Город Волгоград Проспект им В.И.Ленина Дом 46;;;;;;;;;;;;;;;;;;;
ATM70906;Край Красноярский Город Норильск Проспект Ленинский Дом 8;;;;;;;;;;;;;;;;;;;
ATM70908;Область Новосибирская Город Бердск Улица Ленина Дом 89/15;;;;;;;;;;;;;;;;;;;
ATM70909;Область Новосибирская Город Новосибирск Ветка метро Ленинская Станция метро Площадь Маркса;;;;;;;;;;;;;;;;;;;
ATM70911;Область Кемеровская Город Кемерово Проспект Шахтеров Дом 54;;;;;;;;;;;;;;;;;;;
ATM70916;Область Магаданская Город Магадан Улица Болдырева Дом 6;;;;;;;;;;;;;;;;;;;
ATM70917;Область Новосибирская Город Новосибирск Улица Орджоникидзе Дом 23;;;;;;;;;;;;;;;;;;;
ATM70918;Область Новосибирская Город Новосибирск Ветка метро Ленинская Станция метро Площадь Ленина;;;;;;;;;;;;;;;;;;;
ATM70919;Область Новосибирская Город Новосибирск Ветка метро Дзержинская Станция метро Маршала Покрышкина;;;;;;;;;;;;;;;;;;;
ATM70920;Область Новосибирская Город Новосибирск Проспект Красный Дом 161;;;;;;;;;;;;;;;;;;;
ATM70922;Автономная область Еврейская Город Биробиджан Улица Ленина Дом 11;;;;;;;;;;;;;;;;;;;
ATM70927;Область Смоленская Район Вяземский Город Вязьма Улица Кронштадтская Дом 113;;;;;;;;;;;;;;;;;;;
ATM70929;Край Приморский Город Находка Улица Ленинская Дом 10;;;;;;;;;;;;;;;;;;;
ATM70935;Область Липецкая Город Липецк Улица Советская Дом 4;;;;;;;;;;;;;;;;;;;
ATM70936;Край Краснодарский Город Краснодар Улица Мачуги Дом 2;;;;;;;;;;;;;;;;;;;
ATM70941;Край Приморский Город Владивосток Проспект Океанский Дом 111;;;;;;;;;;;;;;;;;;;
ATM70964;Область Томская Район Шегарский Село Мельниково Улица Коммунистическая Дом 9;;;;;;;;;;;;;;;;;;;
ATM70970;Область Ростовская Город Ростов-на-Дону Проспект Сельмаш Дом 98/11;;;;;;;;;;;;;;;;;;;
ATM70971;Край Хабаровский Город Хабаровск Улица Серышева Дом 60;;;;;;;;;;;;;;;;;;;
ATM70985;Область Астраханская Город Астрахань Улица Магистральная Дом 34;;;;;;;;;;;;;;;;;;;
ATM70989;Область Амурская Город Белогорск Улица Скорикова Дом 17;;;;;;;;;;;;;;;;;;;
ATM71000;Край Краснодарский Город Новороссийск Проспект Ленина Дом 22;;;;;;;;;;;;;;;;;;;
ATM71002;Край Краснодарский Город Краснодар Улица Старокубанская Дом 114;;;;;;;;;;;;;;;;;;;
ATM71005;Край Краснодарский Город Краснодар Улица Крылатая Дом 2;;;;;;;;;;;;;;;;;;;
ATM71007;Область Мурманская Город Мурманск Улица Шмидта Дом 43;;;;;;;;;;;;;;;;;;;
ATM71009;Область Омская Город Омск Улица Северная 5-я Дом 193;;;;;;;;;;;;;;;;;;;
ATM71011;Область Челябинская Город Челябинск Улица Салютная Дом 27;;;;;;;;;;;;;;;;;;;
ATM71013;Республика Хакасия Город Абакан Улица Торговая Дом 5;;;;;;;;;;;;;;;;;;;
ATM71015;Область Омская Город Омск Улица Красногвардейская Дом 42;;;;;;;;;;;;;;;;;;;
ATM71021;Край Хабаровский Город Хабаровск Улица Ким-Ю-Чена Дом 26;;;;;;;;;;;;;;;;;;;
ATM71022;Область Оренбургская Город Оренбург Проспект Дзержинского Дом 27/2;;;;;;;;;;;;;;;;;;;
ATM71025;Край Хабаровский Город Хабаровск Улица Целинная Дом 10Д;;;;;;;;;;;;;;;;;;;
ATM71029;Область Новосибирская Город Новосибирск Улица Курчатова Дом 1;;;;;;;;;;;;;;;;;;;
ATM71031;Область Омская Город Омск Улица Ленина Дом 12;;;;;;;;;;;;;;;;;;;
ATM71032;Область Омская Город Омск Улица Профинтерна Дом 7;;;;;;;;;;;;;;;;;;;
ATM71034;Край Камчатский Город Петропавловск-Камчатский Улица Степная Дом 50;;;;;;;;;;;;;;;;;;;
ATM71035;Область Мурманская Город Мончегорск Проспект Металлургов Дом 52;;;;;;;;;;;;;;;;;;;
ATM71036;Область Курская Город Курск Проспект Хрущева Дом 2;;;;;;;;;;;;;;;;;;;
ATM71037;Край Хабаровский Город Хабаровск Улица Вахова А.А. Дом 2;;;;;;;;;;;;;;;;;;;
ATM71043;Область Кемеровская Город Кемерово Улица Баумана Дом 20;;;;;;;;;;;;;;;;;;;
ATM71044;Край Красноярский Город Красноярск Улица Марковского Дом 57;;;;;;;;;;;;;;;;;;;
ATM71046;Область Амурская Район Ивановский Село Ивановка Улица Луговая Дом 28а;;;;;;;;;;;;;;;;;;;
